{
  "schemaVersion": 1,
  "status": "PHASE4_CANDIDATE",
  "runtimeEnabled": false,
  "limits": {
    "maxSfxVoices": 4,
    "maxBgmVoices": 1,
    "crossfadeMs": 350
  },
  "cues": [
    {
      "id": "ui_click",
      "category": "ui",
      "usage": "按钮确认触摸",
      "trigger": "按钮确认触摸",
      "priority": 1,
      "loop": false,
      "suggestedDurationMs": 80,
      "assetStatus": "PLANNED",
      "assetKey": "ui/audio/ui_click",
      "cooldownMs": 250
    },
    {
      "id": "ui_back",
      "category": "ui",
      "usage": "返回页面",
      "trigger": "返回页面",
      "priority": 1,
      "loop": false,
      "suggestedDurationMs": 100,
      "assetStatus": "PLANNED",
      "assetKey": "ui/audio/ui_back",
      "cooldownMs": 250
    },
    {
      "id": "ui_open",
      "category": "ui",
      "usage": "Modal打开",
      "trigger": "Modal打开",
      "priority": 2,
      "loop": false,
      "suggestedDurationMs": 150,
      "assetStatus": "PLANNED",
      "assetKey": "ui/audio/ui_open",
      "cooldownMs": 250
    },
    {
      "id": "ui_close",
      "category": "ui",
      "usage": "Modal关闭",
      "trigger": "Modal关闭",
      "priority": 2,
      "loop": false,
      "suggestedDurationMs": 120,
      "assetStatus": "PLANNED",
      "assetKey": "ui/audio/ui_close",
      "cooldownMs": 250
    },
    {
      "id": "ui_success",
      "category": "ui",
      "usage": "非奖励操作成功",
      "trigger": "非奖励操作成功",
      "priority": 2,
      "loop": false,
      "suggestedDurationMs": 280,
      "assetStatus": "PLANNED",
      "assetKey": "ui/audio/ui_success",
      "cooldownMs": 250
    },
    {
      "id": "ui_fail",
      "category": "ui",
      "usage": "业务拒绝或失败",
      "trigger": "业务拒绝或失败",
      "priority": 1,
      "loop": false,
      "suggestedDurationMs": 200,
      "assetStatus": "PLANNED",
      "assetKey": "ui/audio/ui_fail",
      "cooldownMs": 250
    },
    {
      "id": "game_recruit",
      "category": "game",
      "usage": "招募成功事件",
      "trigger": "招募成功事件",
      "priority": 1,
      "loop": false,
      "suggestedDurationMs": 240,
      "assetStatus": "PLANNED",
      "assetKey": "ui/audio/game_recruit",
      "cooldownMs": 250
    },
    {
      "id": "game_merge",
      "category": "game",
      "usage": "合成成功事件",
      "trigger": "合成成功事件",
      "priority": 1,
      "loop": false,
      "suggestedDurationMs": 320,
      "assetStatus": "PLANNED",
      "assetKey": "ui/audio/game_merge",
      "cooldownMs": 250
    },
    {
      "id": "game_salary",
      "category": "game",
      "usage": "工资实际增加，按秒聚合",
      "trigger": "工资实际增加，按秒聚合",
      "priority": 2,
      "loop": false,
      "suggestedDurationMs": 160,
      "assetStatus": "PLANNED",
      "assetKey": "ui/audio/game_salary",
      "cooldownMs": 250
    },
    {
      "id": "game_cultivation",
      "category": "game",
      "usage": "修为实际增加",
      "trigger": "修为实际增加",
      "priority": 2,
      "loop": false,
      "suggestedDurationMs": 220,
      "assetStatus": "PLANNED",
      "assetKey": "ui/audio/game_cultivation",
      "cooldownMs": 250
    },
    {
      "id": "game_work",
      "category": "game",
      "usage": "切换WORK成功",
      "trigger": "切换WORK成功",
      "priority": 2,
      "loop": false,
      "suggestedDurationMs": 180,
      "assetStatus": "PLANNED",
      "assetKey": "ui/audio/game_work",
      "cooldownMs": 250
    },
    {
      "id": "game_fishing",
      "category": "game",
      "usage": "切换FISHING成功",
      "trigger": "切换FISHING成功",
      "priority": 2,
      "loop": false,
      "suggestedDurationMs": 250,
      "assetStatus": "PLANNED",
      "assetKey": "ui/audio/game_fishing",
      "cooldownMs": 250
    },
    {
      "id": "game_promotion",
      "category": "game",
      "usage": "晋升成功",
      "trigger": "晋升成功",
      "priority": 0,
      "loop": false,
      "suggestedDurationMs": 900,
      "assetStatus": "PLANNED",
      "assetKey": "ui/audio/game_promotion",
      "cooldownMs": 250
    },
    {
      "id": "game_promotion_fail",
      "category": "game",
      "usage": "晋升失败",
      "trigger": "晋升失败",
      "priority": 0,
      "loop": false,
      "suggestedDurationMs": 400,
      "assetStatus": "PLANNED",
      "assetKey": "ui/audio/game_promotion_fail",
      "cooldownMs": 250
    },
    {
      "id": "game_achievement",
      "category": "game",
      "usage": "成就解锁聚合",
      "trigger": "成就解锁聚合",
      "priority": 2,
      "loop": false,
      "suggestedDurationMs": 450,
      "assetStatus": "PLANNED",
      "assetKey": "ui/audio/game_achievement",
      "cooldownMs": 250
    },
    {
      "id": "game_daily_reward",
      "category": "game",
      "usage": "每日奖励领取成功",
      "trigger": "每日奖励领取成功",
      "priority": 2,
      "loop": false,
      "suggestedDurationMs": 350,
      "assetStatus": "PLANNED",
      "assetKey": "ui/audio/game_daily_reward",
      "cooldownMs": 250
    },
    {
      "id": "events_boss",
      "category": "events",
      "usage": "老板主题事件展示",
      "trigger": "老板主题事件展示",
      "priority": 3,
      "loop": false,
      "suggestedDurationMs": 300,
      "assetStatus": "PLANNED",
      "assetKey": "ui/audio/events_boss",
      "cooldownMs": 250
    },
    {
      "id": "events_meeting",
      "category": "events",
      "usage": "会议主题事件展示",
      "trigger": "会议主题事件展示",
      "priority": 3,
      "loop": false,
      "suggestedDurationMs": 250,
      "assetStatus": "PLANNED",
      "assetKey": "ui/audio/events_meeting",
      "cooldownMs": 250
    },
    {
      "id": "events_production_alert",
      "category": "events",
      "usage": "线上告警事件展示，非真实报警",
      "trigger": "线上告警事件展示，非真实报警",
      "priority": 2,
      "loop": false,
      "suggestedDurationMs": 350,
      "assetStatus": "PLANNED",
      "assetKey": "ui/audio/events_production_alert",
      "cooldownMs": 250
    },
    {
      "id": "events_salary_raise",
      "category": "events",
      "usage": "加薪事件实际生效",
      "trigger": "加薪事件实际生效",
      "priority": 2,
      "loop": false,
      "suggestedDurationMs": 400,
      "assetStatus": "PLANNED",
      "assetKey": "ui/audio/events_salary_raise",
      "cooldownMs": 250
    },
    {
      "id": "events_layoff_rumor",
      "category": "events",
      "usage": "裁员传闻事件展示",
      "trigger": "裁员传闻事件展示",
      "priority": 3,
      "loop": false,
      "suggestedDurationMs": 300,
      "assetStatus": "PLANNED",
      "assetKey": "ui/audio/events_layoff_rumor",
      "cooldownMs": 250
    },
    {
      "id": "bgm_office_day",
      "category": "bgm",
      "usage": "前台普通办公室",
      "trigger": "前台普通办公室",
      "priority": 3,
      "loop": true,
      "suggestedDurationMs": 60000,
      "assetStatus": "PLANNED",
      "assetKey": "ui/audio/bgm_office_day",
      "cooldownMs": 0
    },
    {
      "id": "bgm_office_night",
      "category": "bgm",
      "usage": "前台夜间办公室视觉主题",
      "trigger": "前台夜间办公室视觉主题",
      "priority": 3,
      "loop": true,
      "suggestedDurationMs": 60000,
      "assetStatus": "PLANNED",
      "assetKey": "ui/audio/bgm_office_night",
      "cooldownMs": 0
    },
    {
      "id": "bgm_promotion",
      "category": "bgm",
      "usage": "答辩仪式打开，结果后恢复原曲",
      "trigger": "答辩仪式打开，结果后恢复原曲",
      "priority": 2,
      "loop": false,
      "suggestedDurationMs": 12000,
      "assetStatus": "PLANNED",
      "assetKey": "ui/audio/bgm_promotion",
      "cooldownMs": 0
    },
    {
      "id": "bgm_rare_event",
      "category": "bgm",
      "usage": "稀有事件展示，关闭后恢复原曲",
      "trigger": "稀有事件展示，关闭后恢复原曲",
      "priority": 2,
      "loop": false,
      "suggestedDurationMs": 8000,
      "assetStatus": "PLANNED",
      "assetKey": "ui/audio/bgm_rare_event",
      "cooldownMs": 0
    }
  ]
}
